{
  "$schema": "../schema/practice-simulation.schema.json",
  "version": "1.0.0",
  "courseId": "cma",
  "section": "CMA1",
  "generatedAt": "2026-03-01T12:27:20.346Z",
  "simulations": [
    {
      "id": "cma1-sim-001",
      "section": "CMA1",
      "title": "Manufacturing Variance Analysis",
      "blueprintArea": "CMA1-C",
      "topic": "Standard Cost Variance Analysis",
      "difficulty": "hard",
      "estimatedTime": 25,
      "scenario": "You are the cost accountant for Precision Manufacturing Inc., which produces industrial components. The company uses a standard costing system. Management has asked you to analyze the variances for the month of October.\n\nDuring October, the company produced 5,000 units of Product X. The standard cost card for one unit is provided in Exhibit 1.\n\nActual results for October are provided in Exhibit 2.",
      "exhibits": [
        {
          "id": "ex1",
          "title": "Standard Cost Card - Product X (per unit)",
          "type": "table",
          "data": "| Cost Element | Quantity | Rate/Price | Total |\n|-------------|----------|------------|-------|\n| Direct Materials | 3 lbs | $8.00/lb | $24.00 |\n| Direct Labor | 2 hours | $25.00/hr | $50.00 |\n| Variable Overhead | 2 DLH | $6.00/DLH | $12.00 |\n| Fixed Overhead | 2 DLH | $10.00/DLH | $20.00 |\n| **Total Standard Cost** | | | **$106.00** |\n\nBudgeted production: 6,000 units\nBudgeted fixed overhead: $120,000"
        },
        {
          "id": "ex2",
          "title": "Actual Results - October",
          "type": "table",
          "data": "| Item | Actual Results |\n|------|----------------|\n| Units Produced | 5,000 units |\n| Direct Materials Purchased | 16,000 lbs at $8.25/lb |\n| Direct Materials Used | 15,200 lbs |\n| Direct Labor | 9,800 hours at $25.50/hr |\n| Variable Overhead Incurred | $60,200 |\n| Fixed Overhead Incurred | $122,000 |"
        }
      ],
      "tasks": [
        {
          "id": "t1",
          "taskNumber": 1,
          "requirement": "Calculate the Direct Materials Price Variance and Direct Materials Quantity Variance. Indicate whether each variance is Favorable (F) or Unfavorable (U).",
          "hints": [
            "Price variance uses actual quantity purchased",
            "Quantity variance uses actual quantity used"
          ],
          "solution": {
            "approach": "Use standard formulas: Price = (AP - SP) × AQ purchased; Quantity = (AQ used - SQ) × SP",
            "calculations": "Standard Quantity Allowed (SQ) = 5,000 units × 3 lbs = 15,000 lbs\n\n**Materials Price Variance:**\n= (Actual Price - Standard Price) × Actual Quantity Purchased\n= ($8.25 - $8.00) × 16,000 lbs\n= $0.25 × 16,000 = $4,000 Unfavorable\n\n**Materials Quantity Variance:**\n= (Actual Quantity Used - Standard Quantity Allowed) × Standard Price\n= (15,200 lbs - 15,000 lbs) × $8.00\n= 200 lbs × $8.00 = $1,600 Unfavorable",
            "answer": {
              "priceVariance": -4000,
              "quantityVariance": -1600
            },
            "explanation": "The price variance is unfavorable because actual price exceeded standard. The quantity variance is unfavorable because more materials were used than allowed for actual production."
          },
          "points": 20,
          "enhanced": true,
          "stepByStep": "Here's how to calculate the Direct Materials Price and Quantity Variances:\n\n1. **Given Information:**\n   * Actual Production: 5,000 units\n   * Standard Quantity per Unit: 3 lbs\n   * Standard Price per lb: $8.00\n   * Actual Quantity Purchased: 16,000 lbs\n   * Actual Quantity Used: 15,200 lbs\n   * Actual Price per lb: $8.25\n\n2. **Formula:**\n   * Direct Materials Price Variance = (Actual Price - Standard Price) × Actual Quantity Purchased\n   * Direct Materials Quantity Variance = (Actual Quantity Used - Standard Quantity Allowed) × Standard Price\n\n3. **Calculation:**\n   * **Standard Quantity Allowed (SQ):**\n      * SQ = Actual Production × Standard Quantity per Unit\n      * SQ = 5,000 units × 3 lbs/unit = 15,000 lbs\n   * **Direct Materials Price Variance:**\n      * Price Variance = (Actual Price - Standard Price) × Actual Quantity Purchased\n      * Price Variance = ($8.25 - $8.00) × 16,000 lbs\n      * Price Variance = $0.25 × 16,000 lbs = $4,000\n      * Since the actual price is higher than the standard price, the variance is Unfavorable.\n   * **Direct Materials Quantity Variance:**\n      * Quantity Variance = (Actual Quantity Used - Standard Quantity Allowed) × Standard Price\n      * Quantity Variance = (15,200 lbs - 15,000 lbs) × $8.00\n      * Quantity Variance = 200 lbs × $8.00 = $1,600\n      * Since the actual quantity used is higher than the standard quantity allowed, the variance is Unfavorable.\n\n4. **Answer:**\n   * Direct Materials Price Variance: $4,000 Unfavorable\n   * Direct Materials Quantity Variance: $1,600 Unfavorable",
          "keyFormula": "Direct Materials Price Variance = (AP - SP) × AQ purchased; Direct Materials Quantity Variance = (AQ used - SQ) × SP",
          "commonMistakes": [
            "Using actual quantity *used* instead of actual quantity *purchased* when calculating the price variance. The price variance isolates the impact of price differences on the *purchase* decision.",
            "Forgetting to calculate the Standard Quantity Allowed (SQ) based on actual production volume. Using budgeted production volume instead will lead to an incorrect quantity variance.",
            "Incorrectly labeling the variance as favorable or unfavorable. Remember, if actual cost is higher than standard cost, the variance is unfavorable, and vice versa."
          ],
          "examTip": "Double-check whether the problem asks for the price variance based on quantity purchased or quantity used. The CMA exam may try to trick you by providing both values. Also, quickly jot down 'AP, SP, AQ used, AQ purchased, SQ' and fill in the values to avoid confusion during the calculation."
        },
        {
          "id": "t2",
          "taskNumber": 2,
          "requirement": "Calculate the Direct Labor Rate Variance and Direct Labor Efficiency Variance. Indicate whether each variance is Favorable (F) or Unfavorable (U).",
          "hints": [
            "Standard hours = Actual units × Standard hours per unit"
          ],
          "solution": {
            "approach": "Use standard formulas: Rate = (AR - SR) × AH; Efficiency = (AH - SH) × SR",
            "calculations": "Standard Hours Allowed (SH) = 5,000 units × 2 hours = 10,000 hours\n\n**Labor Rate Variance:**\n= (Actual Rate - Standard Rate) × Actual Hours\n= ($25.50 - $25.00) × 9,800 hours\n= $0.50 × 9,800 = $4,900 Unfavorable\n\n**Labor Efficiency Variance:**\n= (Actual Hours - Standard Hours Allowed) × Standard Rate\n= (9,800 hours - 10,000 hours) × $25.00\n= -200 hours × $25.00 = $5,000 Favorable",
            "answer": {
              "rateVariance": -4900,
              "efficiencyVariance": 5000
            },
            "explanation": "The rate variance is unfavorable because workers were paid more than standard. The efficiency variance is favorable because fewer hours were worked than allowed."
          },
          "points": 20,
          "enhanced": true,
          "stepByStep": "Here's how to calculate the direct labor variances:\n\n1. **Given Information:**\n   * Actual Units Produced: 5,000 units\n   * Standard Hours per Unit: 2 hours\n   * Standard Labor Rate: $25.00 per hour\n   * Actual Hours Worked: 9,800 hours\n   * Actual Labor Rate: $25.50 per hour\n\n2. **Formula:**\n   * Direct Labor Rate Variance = (Actual Rate - Standard Rate) × Actual Hours\n   * Direct Labor Efficiency Variance = (Actual Hours - Standard Hours Allowed) × Standard Rate\n\n3. **Calculation:**\n   * **Step 1: Calculate Standard Hours Allowed (SH)**\n      * SH = Actual Units Produced × Standard Hours per Unit\n      * SH = 5,000 units × 2 hours/unit = 10,000 hours\n\n   * **Step 2: Calculate Direct Labor Rate Variance**\n      * Labor Rate Variance = (Actual Rate - Standard Rate) × Actual Hours\n      * Labor Rate Variance = ($25.50/hour - $25.00/hour) × 9,800 hours\n      * Labor Rate Variance = $0.50/hour × 9,800 hours = $4,900\n      * Since the actual rate is higher than the standard rate, the variance is Unfavorable.\n\n   * **Step 3: Calculate Direct Labor Efficiency Variance**\n      * Labor Efficiency Variance = (Actual Hours - Standard Hours Allowed) × Standard Rate\n      * Labor Efficiency Variance = (9,800 hours - 10,000 hours) × $25.00/hour\n      * Labor Efficiency Variance = -200 hours × $25.00/hour = -$5,000\n      * Since the actual hours are less than the standard hours allowed, the variance is Favorable.\n\n4. **Answer:**\n   * Direct Labor Rate Variance: $4,900 Unfavorable\n   * Direct Labor Efficiency Variance: $5,000 Favorable",
          "keyFormula": "Direct Labor Rate Variance = (Actual Rate - Standard Rate) × Actual Hours\nDirect Labor Efficiency Variance = (Actual Hours - Standard Hours Allowed) × Standard Rate",
          "commonMistakes": [
            "Forgetting to calculate the Standard Hours Allowed (SH) before calculating the efficiency variance. Always calculate SH first.",
            "Incorrectly labeling the variances as favorable or unfavorable. Remember, if actual cost/hours are *higher* than standard, it's *unfavorable*; if actual is *lower* than standard, it's *favorable*.",
            "Using the actual units produced in the rate variance calculation. The rate variance uses actual hours, not standard hours."
          ],
          "examTip": "Double-check whether the problem asks for the total variance amount or the variance per unit. Pay close attention to the units specified in the question."
        },
        {
          "id": "t3",
          "taskNumber": 3,
          "requirement": "Calculate the Variable Overhead Spending Variance and Variable Overhead Efficiency Variance.",
          "hints": [